{
  "$schema": "http://json-schema.org/draft-07/schema#",
  "$id": "https://frankfu916.github.io/seattrellis/schemas/project.schema.json",
  "title": "SeatTrellis Project",
  "additionalProperties": false,
  "description": "Portable configuration for a local SeatTrellis project workspace.",
  "properties": {
    "kind": {
      "const": "seattrellis_project",
      "default": "seattrellis_project",
      "title": "Kind",
      "type": "string"
    },
    "schema_version": {
      "default": 1,
      "title": "Schema Version",
      "type": "integer"
    },
    "name": {
      "default": "SeatTrellis Project",
      "title": "Name",
      "type": "string"
    },
    "students": {
      "title": "Students",
      "type": "string"
    },
    "layout": {
      "title": "Layout",
      "type": "string"
    },
    "rules": {
      "title": "Rules",
      "type": "string"
    },
    "history_dir": {
      "anyOf": [
        {
          "type": "string"
        },
        {
          "type": "null"
        }
      ],
      "default": null,
      "title": "History Dir"
    },
    "outputs_dir": {
      "default": "outputs",
      "title": "Outputs Dir",
      "type": "string"
    },
    "default_candidates": {
      "default": 5,
      "title": "Default Candidates",
      "type": "integer"
    },
    "default_candidate": {
      "default": "recommended",
      "title": "Default Candidate",
      "type": "string"
    },
    "default_export_format": {
      "default": "html",
      "enum": [
        "html",
        "excel",
        "png"
      ],
      "title": "Default Export Format",
      "type": "string"
    }
  },
  "required": [
    "students",
    "layout",
    "rules"
  ],
  "type": "object",
  "x-seattrellis-artifact": "project",
  "x-seattrellis-schema-version": 1
}
